Title,Summary,Enrollment,Stars,Rating,Link,Category,languages
facebook marketing en español anuncios maestros en ,facebook marketing desde principiantes hasta avanzados unete a mas de estudiantes que ahora son expertos ,1052,4.3,20,https://www.udemy.com/course/facebook-espanol/,Marketing,es
learn how to use telegram and affiliated marketing,el futuro es ahora telegram y marketing de afiliados,8,5.0,6,https://www.udemy.com/course/how-to-use-telegram-and-affiliated-marketing/,Marketing,es
facebook ads domina el marketing en facebook,aprende como hacer campañas de publicidad eficaces en facebook obten mas ventas y mas clientes rapidamente ,20622,4.5,7529,https://www.udemy.com/course/curso-facebook-ads-tu-publico-objetivo-te-esta-esperando/,Marketing,es
curso completo de marketing digital,conviertete en un experto en marketing digital de la mano de profesionales en el area redes sociales seo sem y email,6752,4.1,2231,https://www.udemy.com/course/curso-completo-de-marketing-digital/,Marketing,es
google ads curso completo desde lo basico hasta avanzado,conoce como incrementar tus ventas utilizando correctamente google ads es mejor saber que suponer ,3824,4.6,1320,https://www.udemy.com/course/google-ads-curso-completo-desde-lo-basico-hasta-avanzado/,Marketing,es
curso completo de instagram marketing ,conviertete en un lider en el instagram gana a la competencia y crea una comunidad de fans apasionados por tu contenido,2977,4.4,1026,https://www.udemy.com/course/cursoinstagrammarketing/,Marketing,es
marketing en facebook instagram youtube twitter y google,aprende a crear campañas digitales efectivas paso a paso en las redes sociales e incrementa las ventas de tu negocio ,3684,4.2,919,https://www.udemy.com/course/marketing-en-facebook-instagram-youtube-twitter-y-google/,Marketing,es
google ads busquedas sem adwords marketing digital desde ,• curso google ads en español aprende a posicionarte en google con adwords incrementa las ventas de tu negocio hoy,2628,4.5,887,https://www.udemy.com/course/andresbrachetta-google-ads/,Marketing,es
curso completo google ads adwords actualizado ,gana dinero con google ads adwords y marketing digital haz campañas que te lleven al en resultados de busqueda,9081,4.3,876,https://www.udemy.com/course/google-adwords-para-no-expertos/,Marketing,es
triunfa en social media y conviertete en community manager,aprende todo lo que necesitas saber sobre redes sociales y herramientas para convertirte en community manager ,1862,4.2,727,https://www.udemy.com/course/triunfa-en-social-media/,Marketing,es
crea un embudo de ventas desde cero para tu negocio digital,aprenderas como hacer un embudo de ventas eficaz y que tu trafico se convierta en cliente todo explicado paso a paso ,2733,4.8,681,https://www.udemy.com/course/crea-un-embudo-de-ventas-desde-cero-y-vende-mas/,Marketing,es
community manager facil ,conoceras las principales redes sociales y seras capaz de gestionar tu publicaciones obteniendo una excelente reputacion,1153,4.3,406,https://www.udemy.com/course/community-manager-facil/,Marketing,es
aprende marketing online y redes sociales desde cero , lanzate al mercado e impulsa tus proyectos de a ,1824,4.2,579,https://www.udemy.com/course/marketing-digital-social-media/,Marketing,es
master de marketing digital cursos en ,el curso mas completo de habla hispana para comercializar productos o servicios en internet ,2349,4.2,550,https://www.udemy.com/course/master-de-marketing-digital-12-cursos-en-1/,Marketing,es
curso de facebook messenger chatbot,te enseño a crear tu chatbot personalizado en facebook messenger sin necesidad de programar y totalmente gratis ,1886,4.0,537,https://www.udemy.com/course/curso-de-facebook-messenger-chat-bots/,Marketing,es
facebook marketing desde principiante hasta avanzado,utiliza el marketing en facebook para ampliar tus clientes y optimizar cada campaña con anuncios estrategicos ,1484,4.3,419,https://www.udemy.com/course/facebook-marketing-desde-principiante-hasta-avanzado/,Marketing,es
marketing digital completo desde cero a experto en el , convierte en un experto en marketing digital y lleva tu negocio a un siguiente nivel ,1489,4.5,487,https://www.udemy.com/course/marketing-digital-completo-desde-cero-a-experto-en-el-2018/,Marketing,es
desarrolla tu marca personal con un blog en ,mejora tu carrera profesional y desarrolla tu marca personal con un blog aprende a generar ingresos pasivos con un blog,5477,4.4,486,https://www.udemy.com/course/como-crear-un-blog/,Marketing,es
google adwords para anunciarse con exito actualizado ,un recorrido paso a paso por todo el proceso de creacion analisis y optimizacion de campañas en google adwords ,1709,4.0,438,https://www.udemy.com/course/google-adwords-para-anunciarse-con-exito/,Marketing,es
seo para wordpress guia completa de configuracion,seo para wordpress guia completa de configuracion posicionamiento instalacion de plugins palabras clave y contenido ,1658,4.6,363,https://www.udemy.com/course/guia-completa-de-seo-para-wordpress/,Marketing,es
facebook ads estrategico marketing digital para vender, crear anuncios en facebook ads es facil lo dificil es crear campañas exitosas aprende estrategias para lograrlo,1008,4.5,314,https://www.udemy.com/course/facebook-ads-estrategico-2018-marketing-digital-para-vender/,Marketing,es
analiza tu web con google analytics y google tag manager,aprovecha las funcionalidades de google tag manager para insertar tu codigo de seguimiento de google analytics,9136,4.0,288,https://www.udemy.com/course/analiza-tu-web-con-google-analytics-y-google-tag-manager/,Marketing,es
gana seguidores en instagram curso intensivo ,el mejor curso para aprender a ganar seguidores en instagram sin invertir en publicidad,1537,4.4,217,https://www.udemy.com/course/curso_instagram/,Marketing,es
a z google ads tecnicas de basico a avanzado con adwords,aprende a optimizar al maximo las campañas grupos de anuncios anuncios de textos keywords y crear informes ,4306,4.2,214,https://www.udemy.com/course/google-adwords-2018-desde-fundamentos-hasta-optimizacion/,Marketing,es
chatbot manychat embudo de ventas facebook messenger, crea tu propio chat bot en facebook messenger para vender guia paso a paso utilizando la cuenta gratuita de manychat,704,4.2,194,https://www.udemy.com/course/chatbot-para-vender-embudo-de-ventas-en-facebook-messenger/,Marketing,es
crea tu embudo de ventas paso a paso y vende por internet, guia paso a paso para crear tu embudo de ventas por internet y hacer crecer tu negocio sin importar tu experiencia,876,4.2,189,https://www.udemy.com/course/crea-tu-embudo-de-ventas-paso-a-paso-y-vende-por-internet/,Marketing,es
analitica web con google analytics,vende mas mejorando tus resultados,787,4.5,190,https://www.udemy.com/course/analitica-web-con-google-analytics/,Marketing,es
seminario de neuromarketing e innovacion,comprende a profundidad a tu cliente aprovecha la neurociencia y la psicologia para innovar y posicionar tus marcas ,658,4.1,187,https://www.udemy.com/course/seminario-de-neuromarketing-e-innovacion/,Marketing,es
consultor de marketing y publicidad,conviertete en un consultor para tu empresa o bien rentabiliza tus servicios para otras empresas,6053,4.5,185,https://www.udemy.com/course/estrategias-de-publicidad-y-marketing-de-cero-a-experto/,Marketing,es
clickfunnels como crear embudos de venta de alta conversion,curso de clickfunnels consigue captar clientes y escala tu negocio utilizando los embudos de venta,920,4.5,162,https://www.udemy.com/course/clickfunnels-espanol/,Marketing,es
analisis de datos con google data studio,aprende a utilizar google data studio desde cero para crear informes increibles y conviertete en un experto ,428,4.3,160,https://www.udemy.com/course/google-data-studio/,Marketing,es
instagram paso a paso hasta los seguidores ,haz crecer de forma masiva tus seguidores e interacciones hasta que puedas monetizar tu cuenta ,2059,4.0,160,https://www.udemy.com/course/instagram-2018-paso-a-paso-hasta-los-10000-seguidores/,Marketing,es
como encontrar palabras clave en el planificador de google,como buscar palabras clave con el planificador de palabras clave de google adwords,1930,4.5,155,https://www.udemy.com/course/como-encontrar-palabras-clave-en-el-planificador-de-google/,Marketing,es
mailchimp email marketing desde cero para negocios,la lista de contactos es un activo de tu negocio hazla crecer con email marketing a traves de mailchimp,551,4.6,150,https://www.udemy.com/course/curso-de-email-marketing/,Marketing,es
videocurso de marketing digital para hacer crecer tu negocio,evita errores al emprender online y aprende los principios para hacer crecer tu negocio o proyecto con internet,1729,4.1,147,https://www.udemy.com/course/curso-marketing-digital-online/,Marketing,es
dominando la publicidad en instagram,el curso definitivo para aprender a crear publicidad en instagram para poder vender tus productos y servicios,5207,4.5,139,https://www.udemy.com/course/dominando-publicidad-instagram/,Marketing,es
facebook viral ,aprende como hacer que tu contenido se vuelva viral en facebook publica con estrategia y llega a miles de clientes,2567,4.0,139,https://www.udemy.com/course/facebook-viral/,Marketing,es
marketismo vende tus servicios y productos ,vende tus servicios y productos con redes sociales,781,4.0,138,https://www.udemy.com/course/marketismo/,Marketing,es
youtube master curso completo de youtube,aparece en las primeras paginas de youtube consigue miles de seguidores clientes potenciales trafico web y mas ventas,542,4.2,136,https://www.udemy.com/course/youtube-master/,Marketing,es
whatsapp business marketing como cerrar mas ventas,aprende la estrategia para vender tus productos o servicios utilizando whatsapp como herramienta de marketing y ventas,372,4.1,137,https://www.udemy.com/course/como-vender-por-whatsapp-business-marketing/,Marketing,es
google analytics curso completo con profesor certificado,gestiona la analitica web de tu negocio o empresa,1194,4.0,128,https://www.udemy.com/course/google-analytics-curso-completo-con-profesor-certificado/,Marketing,es
instagram trucos practicos para las historias de instagram,crea contenido de alta calidad estetica aumenta tu engagement alcanza a una audiencia mas amplia y targeteada,716,4.2,123,https://www.udemy.com/course/trucos-practicos-para-las-historias-de-instagram/,Marketing,es
ser el mejor community manager,aprenderas a gestionar desarrollar y vivir de las redes sociales,287,4.4,121,https://www.udemy.com/course/community-manager-x/,Marketing,es
youtube masterclass la guia completa de youtube,guia completa para comenzar tu canal de youtube obtener mas visitas y suscriptores y crear tu propia marca de videos ,1276,4.8,112,https://www.udemy.com/course/youtube-masterclass-la-guia-completa-de-youtube/,Marketing,es
como atraer clientes con google mi negocio ,google my business es la mejor herramienta gratuita para atraer cientos o miles de clientes a tu negocio local,347,4.2,107,https://www.udemy.com/course/como-atraer-clientes-con-google-mi-negocio/,Marketing,es
shopify crea tu propia tienda en linea paso a paso,comienza a vender en linea con shopify construye administra y vende por internet aprovechando mercado pago y facebook,2012,4.4,105,https://www.udemy.com/course/shopify-crea-tu-propia-tienda-en-linea-paso-a-paso/,Marketing,es
marketing de contenidos estrategias para tus redes sociales,como crear tu propia estrategia de inbound marketing en redes sociales para tu negocio ,912,4.4,100,https://www.udemy.com/course/marketing-de-contenidos-estrategias-para-tus-redes-sociales/,Marketing,es
seo local mas dinero con seo local probado ,la mejor estrategia de posicionamiento para negocios locales gana mas dinero con seo local el nuevo marketing digital ,273,4.6,101,https://www.udemy.com/course/seo-local-2020/,Marketing,es
como vender y ganar dinero con tus apps y videojuegos,guia definitiva para promocionar tus apps y videojuegos cubriendo todos los aspectos de aso viralidad kpis y promocion,516,4.3,87,https://www.udemy.com/course/como-promocionar-tus-apps-y-videojuegos/,Marketing,es
como crear una marca desde , aprende a crear una marca de principio a fin y compite contra los mejores ,300,4.4,82,https://www.udemy.com/course/como-crear-una-marca-desde-0/,Marketing,es
seo para no expertos,como llevar cualquier sitio web hasta arriba en los buscadores,3590,4.5,81,https://www.udemy.com/course/seo-para-no-expertos/,Marketing,es
shopify haz dinero con una tienda en linea,aprende a tener exito con ecommerce,1731,4.0,81,https://www.udemy.com/course/curso-shopify/,Marketing,es
instagram marketing como crecer en instagram,guia paso a paso sobre como crecer en instagram utilizando las mejores estrategias de marketing en redes sociales ,1155,4.3,81,https://www.udemy.com/course/instagram-marketing-2018-como-crecer-en-instagram/,Marketing,es
marketing de afiliados como generar ingresos pasivos online,descubre las fases del sistema que me genera mas de dolares al año en ingresos pasivos como afiliado,297,4.1,76,https://www.udemy.com/course/marketing-de-afiliados-como-generar-100000-dolares-al-ano/,Marketing,es
posicionamiento seo para principiantes,aprende como posicionar tu web en google y deja que los clientes te encuentren a ti ,533,4.5,76,https://www.udemy.com/course/curso-seo-principiantes/,Marketing,es
certificacion en marketing llega a de clientes,aprende como hacer campañas de marketing para tu negocio organizacion o idea obten mas ventas y mas clientes,804,4.3,76,https://www.udemy.com/course/marketing-completo-en-120-minutos-profesor-premiado/,Marketing,es
seo facil y util,como disparar las visitas a tu web con posicionamiento en buscadores,986,4.2,76,https://www.udemy.com/course/seo-facil-y-util/,Marketing,es
power bi introduccion y diseño de un dashboard en ,conoce las herramientas de power bi como añadir calculos dax y como diseñar un dashboard en minutos,1124,4.1,70,https://www.udemy.com/course/power-bi-introduccion-y-diseno-un-dashboard-en-20-minutos/,Marketing,es
 marca la diferencia con el marketing digital , curso de marketing digital muy practico   actualizado agosto comienza a ser un experto,1032,4.9,69,https://www.udemy.com/course/curso-marketing-digital-2019/,Marketing,es
como escribir para internet con seo y usabilidad,el seo y la usabilidad son los dos factores de mayor importancia en los contenidos digitales ,170,4.2,69,https://www.udemy.com/course/como-escribir-para-internet-con-seo-y-usabilidad/,Marketing,es
redes sociales para empresas,maximiza el alcance de tu compañia aprendiendo las mejores practicas en redes sociales ,385,4.4,63,https://www.udemy.com/course/redes-sociales-para-empresas/,Marketing,es
seo avanzado,nuevas tendencias y estrategias en el posicionamiento en buscadores ,389,4.0,61,https://www.udemy.com/course/curso-seo-avanzado/,Marketing,es
conviertete en un community manager,conoce planifica y controla estrategias en las redes sociales para captar clientes online ,183,4.0,60,https://www.udemy.com/course/conviertete-en-un-community-manager/,Marketing,es
curso de marketing online para hoteles hostales y bb,incrementa las reservas de tu hotel hostal o bb incluye tacticas para afrontar la crisis del covid ,522,4.3,56,https://www.udemy.com/course/marketing-digital-hoteles-hostels-posadas/,Marketing,es
como optimizar tu web con seo semantico,mejora tu seo onpage con rich snippets y marcado semantico,112,4.0,21,https://www.udemy.com/course/iniciacion-seo-semantico/,Marketing,es
curso para iniciar en youtube y generar ingresos,descubre como ganar dinero con youtube aplicando metodos para crear y posicionar tu canal de youtube,498,4.5,51,https://www.udemy.com/course/curso-para-iniciar-en-youtube-y-generar-ingresos/,Marketing,es
personal branding diseña tu marca personal,porque necesitas distinguirte en un mercado gris en el que aparentemente todos ofrecemos lo mismo,144,4.3,42,https://www.udemy.com/course/disena-tu-marca-personal/,Marketing,es
redaccion profesional de articulos seo,aprende a crear articulos efectivos para atraer mas visitas y lograr mejor ranking en google,111,4.4,49,https://www.udemy.com/course/redaccion-efectiva-de-articulos-seo/,Marketing,es
como crear un curso online y generar ingresos pasivos,el paso a paso para crear tu primer curso en esta plataforma y recibir tus primeros ingresos por internet ,174,4.5,49,https://www.udemy.com/course/crear-curso-online/,Marketing,es
aprende semrush desde cero la mejor herramienta seo,mejora el posicionamiento de tus palabras clave en google y mucho mas facilmente incluye semrush gratis dias ,233,4.1,49,https://www.udemy.com/course/semrush-herramienta-seo-palabras-clave-google/,Marketing,es
como usar pinterest para aumentar las ventas de tu negocio,aprende a crear corchos coloridos y divertidos para generar trafico a tu pagina e incrementar las ventas de tu tienda ,1404,4.3,48,https://www.udemy.com/course/como-usar-pinterest-para-hacer-crecer-tu-negocio/,Marketing,es
el metodo dropshipping analitico ,aprende dropshipping con un nuevo metodo de analitica de productos ganadores deja de perder dinero con tus campañas ,357,4.7,47,https://www.udemy.com/course/el-metodo-dropshipping-analitico-2020/,Marketing,es
crea un lead magnet irresistible paso a paso en a horas,descubre como crear en menos de horas un lead magnet que atraiga a tus clientes ideales y que te ayude a vender mas,706,4.0,45,https://www.udemy.com/course/como-crear-un-lead-magnet/,Marketing,es
facebook empresarial el marketing ideal para los negocios,conoce planifica y controla las acciones necesarias para captar clientes con una fan page ,107,4.5,45,https://www.udemy.com/course/facebook-empresarial-el-marketing-ideal-para-los-negocios/,Marketing,es
facebook ads para negocios locales, campañas avanzadas inscribete hoy ,2282,4.6,43,https://www.udemy.com/course/aprende-facebook-ads-clic-por-clic/,Marketing,es
curso intermedio de instagram para crear tu marca personal,crea contenido relevante para posicionar tu marca personal y crecer tu audiencia de forma organica evitando bloqueos,88,4.5,43,https://www.udemy.com/course/curso-intermedio-de-instagram-para-crear-tu-marca-personal/,Marketing,es
copywriting textos efectivos para marketing online,redes sociales whatsapp y correo electronico inscribete hoy ,2481,4.5,43,https://www.udemy.com/course/copywriting-para-hacer-marketing-online/,Marketing,es
linkedin y social selling para mejorar tus ventas,aumentar las ventas online de tu negocio en el canal profesional mejorando los objetivos financieros de tu empresa,157,4.4,41,https://www.udemy.com/course/linkedin-y-social-selling-para-mejorar-tus-ventas/,Marketing,es
marketing de contenidos para principiantes la guia completa,aprende a utilizar marketing de contenido moderno para hacer crecer tu negocio y tu marca,632,4.6,41,https://www.udemy.com/course/marketing-de-contenidos-para-principiantes-la-guia-completa/,Marketing,es
 como crear un plan de marketing digital para tu sitio web,aprenda como crear su embudo de ventas para tu sitio web tacticas y estrategias para mejorar tus ventas en linea,2419,4.4,40,https://www.udemy.com/course/como-crear-un-plan-de-marketing-digital-para-tu-sitio-web/,Marketing,es
maestria en facebook crea una marca exitosa,aprende a crear contenido que conecte con tu publico y te ayude a aumentar tus ventas sin pagar por anuncios de facebook,1376,4.5,40,https://www.udemy.com/course/maestria-en-facebook/,Marketing,es
guia completa y real para crecer en youtube,aprende de un youtuber con mas de suscriptores todos los tips y estrategias reales para crecer en youtube ,122,4.7,39,https://www.udemy.com/course/cursodeyoutube/,Marketing,es
curso de clickbank aprende las estrategias ganadoras ,lo que los gurus no enseñan sin secretos yo te revelo todo para ser exitoso en el mercado de afiliados ,84,4.7,38,https://www.udemy.com/course/como-ganar-dinero-online-con-clickbank/,Marketing,es
instagram marketing para negocio,las mejores estrategias de instagram marketing para tu negocio,432,4.3,35,https://www.udemy.com/course/instagram-marketing-para-negocio-estrategias/,Marketing,es
embudo de ventas email marketing y persuasion,crea un embudo de ventas y genera dinero con tus productos,1120,4.0,34,https://www.udemy.com/course/academia-de-ventas/,Marketing,es
crea una tienda de afiliados de amazon con wordpress,aprende a crear una tienda de afiliados para vender productos de amazon ganando atractivas comisiones,160,4.0,33,https://www.udemy.com/course/crea-una-tienda-de-afiliados-de-amazon-con-wordpress/,Marketing,es
como hacer ventas con llamada en frio cold calling ,telemarketing televenta o ventas por telefono es una forma muy utilizada para vender pero pocos tienen un gran sistema,249,4.5,33,https://www.udemy.com/course/como-hacer-clientes-nuevos-con-telemarketing-o-televenta/,Marketing,es
incrementa la interaccion de tus seguidores en facebook,aprende como mejorar el impacto de tus publicaciones de facebook diversificando tus contenidos y como hacerlo gratis,280,4.3,33,https://www.udemy.com/course/incrementa-la-interaccion-de-tus-seguidores-en-facebook/,Marketing,es
investigacion de mercado crea tu estrategia exitosa online,crea tu estrategia paso a paso inscribete hoy ,2633,4.4,32,https://www.udemy.com/course/crea-una-estrategia-exitosa-online/,Marketing,es
 como vender en marketplaces y en amazon con exito ,desde la estrategia comercial hasta el lanzamiento de un producto en amazon ,99,4.6,32,https://www.udemy.com/course/venderenamazonmexico/,Marketing,es
curso de copywriting como persuadir con tus textos,diras mas con menos y eso el lector lo agradece,79,4.2,33,https://www.udemy.com/course/curso-copywriting-sidney/,Marketing,es
estrategias avanzadas de pinterest para negocios,aprende a utilizar pinterest para generar una base de seguidores deseosos de tus productos y servicios ,194,4.3,32,https://www.udemy.com/course/estrategias-avanzadas-de-pinterest-para-negocios/,Marketing,es
mailchimp de novato a experto,se un experto en marketing por email usando mailchimp curso actualizado con la nueva interfaz de mailchimp ,294,4.6,31,https://www.udemy.com/course/mailchimp-de-novato-a-experto/,Marketing,es
como ser un influencer exitoso en pasos,comparte tu pasion con millones y monetiza creando exitoso contenido digital en todas las plataformas,64,4.5,31,https://www.udemy.com/course/como-ser-un-influencer-exitoso-en-6-pasos/,Marketing,es
como hacer screenshots para tus apps de manera facil,como hacer unos screenshots para tus aplicaciones de manera sencilla ,843,4.3,30,https://www.udemy.com/course/como-hacer-screenshots-para-tus-apps-de-manera-facil/,Marketing,es
google mi negocio seo local google maps marketing digital ,• curso google mi negocio aprende a posicionarte en google google maps seo local para llegar a nuevos clientes ,548,4.5,30,https://www.udemy.com/course/google-my-business-seo-local-google-maps-marketing-digital/,Marketing,es
curso marketing digital marketing para principiantes,descubre como atraer clientes generar ventas y lograr un marketing irresistible en tu negocio online,148,4.2,29,https://www.udemy.com/course/curso-marketing-digital/,Marketing,es
adwords de google crea las mejores campañas publicitarias,aprende todos los trucos y tecnicas para crear anuncios de google adwords de forma rapida directa y efectiva,250,4.0,29,https://www.udemy.com/course/adwords-de-google-crea-las-mejores-campanas-publicitarias/,Marketing,es
adwords de google crea las mejores campañas publicitarias,aprende todos los trucos y tecnicas para crear anuncios de google adwords de forma rapida directa y efectiva,250,4.0,29,https://www.udemy.com/course/adwords-de-google-crea-las-mejores-campanas-publicitarias/,Marketing,es
secretos de los anuncios efectivos en facebook® ads ,aprende los secretos de la publicidad de facebook® y como atraer clientes por poco dinero,2213,4.1,28,https://www.udemy.com/course/publicidad-en-facebook-con-neuromarketing/,Marketing,es
copywriting para agentes de bienes raices,despertaras emociones en tus clientes que los hagan vibrar y desear quedarse con la propiedad que tu vendes,97,4.6,26,https://www.udemy.com/course/copywriting-para-agentes-de-bienes-raices/,Marketing,es
google adwords crea exitosas campañas publicitarias online,obten el maximo desempeño en la captacion de clientes para un negocio o empresa con la publicidad de google adwords,106,4.3,26,https://www.udemy.com/course/google-adwords-crea-exitosas-campanas-publicitarias-online/,Marketing,es
desarrolla tu creatividad en el mundo de la publicidad,la campaña en este curso de creatividad aprenderas los secretos de la comunicacion publicitaria ,66,4.5,25,https://www.udemy.com/course/desarrolla-tu-creatividad-en-el-mundo-de-la-publicidad/,Marketing,es
curso completo de anuncios de instagram,use todo el poder de los anuncios de instagram para aumentar sus ventas y crecer su marca de manera exponencial ,155,4.4,24,https://www.udemy.com/course/anuncios-instagram/,Marketing,es
curso marketing de contenidos mejora tu seo y tus ventas,aprende a aplicar el marketing de contenidos para ganar visibilidad crear marca y ganar clientes,81,4.0,25,https://www.udemy.com/course/curso-marketing-de-contenidos/,Marketing,es
plan de marketing digital diseña la estrategia perfecta,aprende a establecer los objetivos comerciales online de una empresa y las estrategias a seguir para alcanzarlos ,94,4.1,23,https://www.udemy.com/course/plan-de-marketing-digital-disena-la-estrategia-perfecta/,Marketing,es
atrae miles de visitas desde el primer dia con pinterest,descubre como pinterest puedo enviarte mas trafico web que facebook instagram y youtube juntas ,81,4.4,23,https://www.udemy.com/course/curso-pinterest-sidney/,Marketing,es
marketing de turismo de aventura a nivel tour operador local,un mercadeo efectivo requiere de estrategias de vision amplia para tus canales online y offline ,66,4.2,23,https://www.udemy.com/course/marketing-de-turismo-de-aventura-a-nivel-tour-operador-local/,Marketing,es
