Title,Summary,Enrollment,Stars,Rating,Link,Category,languages
como ganar dinero invirtiendo en bolsa,sacale el maximo partido a tu dinero aprendiendo a identificar los valores mas rentables,12495,4.1,1140,https://www.udemy.com/course/como-ganar-dinero-invirtiendo-en-bolsa/,Finance,es
curso forex basico ejemplos en vivo de trading real,guia completa para entender el mercado forex desde cero aprende paso a paso como hacer trading real,3856,4.6,905,https://www.udemy.com/course/curso-forex-basico-ejemplos-en-vivo-de-trading-real/,Finance,es
invertir en bolsa analisis tecnico desde cero a intermedio,como hacer analisis tecnico para ganar dinero invirtiendo en bolsa,1133,4.6,751,https://www.udemy.com/course/invertir-en-bolsa-analisis-tecnico-desde-cero-a-intermedio/,Finance,es
guia practica para comprar acciones en la bolsa de usa,aprende de una forma practica y didactica como comprar acciones en la bolsa de valores de los estados unidos ,16805,4.4,623,https://www.udemy.com/course/guia-practica-para-comprar-acciones-en-la-bolsa-de-usa/,Finance,es
contabilidad rapida y eficaz,con esta tecnica veras la contabilidad mas facil podras subir tus ingresos y ganar mas tiempo libre ,2015,4.1,606,https://www.udemy.com/course/contabilidad11/,Finance,es
analisis financiero corporativo,desarrollo del analisis financiero sus principales herramientas indicadores y la construccion de reportes,1494,4.5,429,https://www.udemy.com/course/curso-de-analisis-financiero-corporativo/,Finance,es
bolsa de valores usa para principiantes,curso sobre bolsa de valores de nueva york,1076,4.4,378,https://www.udemy.com/course/bolsa-de-valores-para-principiantes/,Finance,es
excel aplicado al analisis financiero,diseña modelos para finanzas corporativas con excel todas las matematicas financieras para desarrollar tu negocio,2233,4.5,228,https://www.udemy.com/course/excel-aplicado-al-analisis-financiero/,Finance,es
curso de analisis fundamental desde cero,como hacer analisis fundamental para ganar dinero invirtiendo en bolsa,629,4.5,196,https://www.udemy.com/course/invertir-en-bolsa-analisis-fundamental-desde-cero/,Finance,es
introduccion al trading de opciones,curso introductorio para personas interesadas en aprender los conceptos basicos del trading de opciones financieras ,1860,4.8,185,https://www.udemy.com/course/curso-de-opciones-basico/,Finance,es
inteligencia financiera y crecimiento personal,puedes tener mas de lo que tienes si estas dispuesto a ser mas de lo que eres,423,4.6,157,https://www.udemy.com/course/inteligencia-financiera-y-crecimiento-personal/,Finance,es
trading con ondas de elliott,aprende esta poderosa estrategia de trading para invertir en acciones criptomonedas forex y futuros,1058,4.4,153,https://www.udemy.com/course/curso-completo-de-ondas-de-elliott-para-traders/,Finance,es
introduccion a la contabilidad,aprenda los conceptos basicos de la contabilidad y a hacer asientos contables de forma rapida y amena ,521,4.6,141,https://www.udemy.com/course/contabilidad-en-una-hora/,Finance,es
inversion en bolsa importante cuando invertir en bolsa ,curso de bolsa lo que nadie explica sobre el verdadero funcionamiento de la bolsa ,395,4.6,127,https://www.udemy.com/course/curso-de-bolsa-desde-cero-momentos-para-entrar-y-salir-de-la-bolsa/,Finance,es
aprende a invertir en bolsa desde cero,aprende a analizar y valorar empresas para tener exito en el mercado de valores invierte en bolsa sin tener experiencia,349,4.4,104,https://www.udemy.com/course/aprende-a-invertir-en-bolsa-desde-cero/,Finance,es
trading forex comienza a invertir en el mercado de forex,como hacer trading en forex desde cero estrategias de rentables de analisis tecnico,1122,4.4,101,https://www.udemy.com/course/5-estrategias-para-invertir-en-acciones-forex-y-criptomedas/,Finance,es
invertir en forex y acciones eeuu a experto ,herramientas practicas para invertir en forex y en la bolsa de usa sin tener experiencia previa ejemplos reales en vivo,425,4.7,97,https://www.udemy.com/course/aprende-a-invertir-en-forex-y-acciones-de-eeuu-de-cero-a-experto/,Finance,es
finanzas para emprendedores plan financiero desde cero,si no sabes de finanzas y tienes un proyecto de negocio o ya lo iniciaste este curso te sera de mucha utilidad ,285,4.2,96,https://www.udemy.com/course/finanzas-para-emprendedores/,Finance,es
finanzas personales para principiantes,aprende a usar las herramientas basicas para controlar tus finanzas personales ,409,4.2,95,https://www.udemy.com/course/finanzas-personales-para-principiantes/,Finance,es
daytrading basado en precio y volumen,aprende a hacer daytrading comprendiendo que esta ocurriendo en el mercado estudiando la oferta y la demanda,313,4.3,94,https://www.udemy.com/course/trading-intradiario-basado-en-precio-y-volumen/,Finance,es
curso bolsa de valores para principiantes,inversion en acciones empresariales y trading de opciones sin conocimiento sobre mercados financieros,285,4.2,90,https://www.udemy.com/course/curso-de-bolsa-de-valores-para-principiantes/,Finance,es
curso finanzas personales mejora tu vida y obten libertad,un plan para salir de deudas rapido y ser financieramente libre,1745,4.3,80,https://www.udemy.com/course/curso-de-finanzas-personales-mejora-tu-vida-y-obten-liberta/,Finance,es
blockchain entendiendo la cadena de bloques y su evolucion,desde bitcoin pasando por ethereum e incluso iota un recorrido completo por toda la evolucion de blockchain ,221,4.2,79,https://www.udemy.com/course/introduccion-a-blockchain/,Finance,es
aprende a invertir sin capital,aprende e invierte en el mercado de valores de una forma sencilla y amena,721,4.4,69,https://www.udemy.com/course/aprende-a-invertir-sin-capital/,Finance,es
curso quickbooks online en español con actualizaciones ,administra tu negocio en linea curso de quickbooks en español enseñado paso a paso con actualizaciones y ayudas ,127,4.8,67,https://www.udemy.com/course/quickbooksenespanol/,Finance,es
finanzas personales para vivir libre de deudas,descubre como tener una vida prospera sin problemas de dinero y evita caer en la trampa de la bancarrota,267,4.0,65,https://www.udemy.com/course/finanzas-personales-para-vivir-libre-de-deudas/,Finance,es
curso completo de ingenieria economica con excel ,estudios economicos y financieros para ingenieros y otros profesionales resolucion de problemas practicos paso a paso ,2208,4.4,62,https://www.udemy.com/course/curso-completo-de-ingenieria-economica-con-excel/,Finance,es
como invertir en los mercados financieros,aprenda que son los mercados financieros y como cualquiera puede ganar dinero desde su casa ,1007,4.4,60,https://www.udemy.com/course/como-invertir-en-los-mercados-financieros/,Finance,es
contabilidad gubernamental en mexico,curso creado para conocer y aplicar conceptos derivados del marco legal de contabilidad gubernamental ,406,4.5,60,https://www.udemy.com/course/contabilidad-gubernamental/,Finance,es
como analizar las finanzas de una empresa paso por paso, aprende como los profesionales analizan la situacion financiera de cualquier compañia ,536,4.3,60,https://www.udemy.com/course/como-analizar-las-finanzas-de-una-empresa-paso-por-paso/,Finance,es
trading de futuros siguiendo al profesional con wyckoff,aprenda como piensa el profesional y como funciona su manipulacion en el mercado ,228,4.6,59,https://www.udemy.com/course/tradingdefuturos-siguiendolahuellaprofesional/,Finance,es
guia completa de trading analisis tecnico de los mercados,aprende a analizar los mercados financieros de manera logica elaborar hipotesis y a operar cualquier instrumento ,222,4.1,58,https://www.udemy.com/course/guia-completa-de-trading-analisis-tecnico-de-los-mercados/,Finance,es
opciones sobre acciones,curso de opciones sobre acciones en la bolsa de valores de eeuu ,158,4.4,54,https://www.udemy.com/course/opciones-sobre-acciones/,Finance,es
curso de forex de basico a avanzado como ser trader ,descubre las formas patrones y consejos utiles y aplicables para ganar dinero en el mercado de divisas,164,4.8,52,https://www.udemy.com/course/curso-forex/,Finance,es
fundamentos de finanzas aprende usando excel,aprende finanzas mientras mejoras tus habilidades en excel multiples ejercicios para cada tema ,263,4.8,48,https://www.udemy.com/course/fundamentos-de-finanzas-aprende-usando-excel/,Finance,es
bitcoin el futuro del dinero hoy,la revolucion de la industria de servicios financieros ha comenzado,148,4.1,48,https://www.udemy.com/course/bitcoin-el-futuro-del-dinero-hoy/,Finance,es
fondos de inversion la estrategia de inversion mas sencilla,invertir tu dinero nunca ha sido tan facil con lo que aprendas en el curso podras invertir sin complicarte la vida,171,4.4,46,https://www.udemy.com/course/fondos-inversion-invertir-bolsa-dinero/,Finance,es
sistema de programacion neurofinanciero pigmalion,comienza a crear tu nueva mentalidad de abundancia,1522,4.7,45,https://www.udemy.com/course/sistema-de-programacion-neurofinanciero-pigmalion/,Finance,es
sesgados sesgos falacias y modelos mentales,sesgos psicologicos falacias logicas modelos mentales teoria de juegos toma de decision psicologia financiera ,295,4.7,45,https://www.udemy.com/course/inversion_psicologia/,Finance,es
la bolsa desde cero instrumentos argentinos de inversion,comenza a dar tus primeros pasos en la bolsa de manera segura ,79,4.5,42,https://www.udemy.com/course/la-bolsa-desde-cero/,Finance,es
programa gestor de carteras de inversion en r studio,pasos y metodologia necesaria para crear y gestionar portfolios de inversion en mercados financieros,11840,4.4,42,https://www.udemy.com/course/programa-gestor-de-carteras-de-inversion-en-r-studio/,Finance,es
tablas dinamicas de excel,la herramienta mas poderosa de excel,148,4.8,42,https://www.udemy.com/course/tablas-dinamicas-de-excel/,Finance,es
curso completo de finanzas personales para no expertos,simple util aplicable eficaz como nunca te lo enseñaron las mejores tecnicas para manejar tu dinero ,97,4.5,36,https://www.udemy.com/course/curso-completo-de-finanzas-personales-para-no-expertos/,Finance,es
asistente contable,elaboracion y presentacion de estados financieros paso a paso de acuerdo a nics,125,4.0,35,https://www.udemy.com/course/asisistente-contable/,Finance,es
matematica financeira de a a z introdutoria volume i ,a forma mais didatica e mais completa de aprender esta tao importante disciplina viaje conosco ,140,4.8,34,https://www.udemy.com/course/matematicafinanceiradeaaz/,Finance,es
analisis fundamental aplicado al mercado de divisas,busqueda de informacion movimientos de las divisas en el corto plazo y los movimientos fundamentales de largo plazo,67,4.1,32,https://www.udemy.com/course/analisis-fundamental-aplicado-al-mercado-de-divisas/,Finance,es
fundamentos de inversiones aprende desde cero,conceptos clave para iniciarte en el mundo de las finanzas y las inversiones,556,4.1,32,https://www.udemy.com/course/fundamentos-de-inversiones-aprende-desde-cero/,Finance,es
como crear politicas contables bajo niif para pymes,modelo de creacion de politicas y procedimientos contables incluye formatos editables para comenzar ahora mismo ,76,4.2,30,https://www.udemy.com/course/como-crear-politicas-contables-bajo-niif-para-pymes/,Finance,es
 como ser inversionista mejora tus finanzas personales,mas de estrategias para cumplir tus metas,82,4.7,29,https://www.udemy.com/course/inversionista/,Finance,es
aprende excel basico desde cero solo principiantes,excel para la casa escuela y negocios,797,4.6,27,https://www.udemy.com/course/aprende-excel-desde-cero-solo-principiantes/,Finance,es
finanzas personales aprende a comprar ahorrar e invertir,cetes bienes raices fondos de inversion criptomonedas fintech afore y mas aprenda a que tu dinero trabaje por ti ,99,4.4,24,https://www.udemy.com/course/finanzas-personales-aprende-a-comprar-ahorrar-e-invertir/,Finance,es
 trading de alta probabilidad forex y bolsa de ny, gana dinero haciendo trading con herramientas faciles de aplicar mas efectivas que cualquier otra tecnica del mercado,94,4.6,24,https://www.udemy.com/course/trading-de-alta-probabilidad/,Finance,es
sistema de sobres para tus finanzas personales,aprende a administrar tu dinero con el sistema de sobres para mejorar tus finanzas personales,81,4.6,24,https://www.udemy.com/course/sistema-de-sobres-para-tus-finanzas-personales/,Finance,es
taller de contabilidad computarizada,aprende el ciclo contable desde cero y sus fundamentos de la manera mas facil rapida y sin complicaciones ,313,4.1,24,https://www.udemy.com/course/taller-de-contabilidad-computarizada/,Finance,es
opciones binarias y digitales para principiantes,aprende lo necesario para operar de manera independiente ,64,4.5,23,https://www.udemy.com/course/opciones-binarias-y-digitales-para-principiantes/,Finance,es
el juego del dinero, queres aprender a administrar tu dinero encontraste el curso ideal,676,4.5,23,https://www.udemy.com/course/el-juego-del-dinero-tu-tutor/,Finance,es
curso de trading practico basado en casos reales,aprende a hacer trading de manera practica con ejemplos reales ,217,4.2,22,https://www.udemy.com/course/trading-practico/,Finance,es
como invertir en forex robots cada mes,conoceras como invertir en forex haciendo trading algoritmico con muchos asesores expertos en una sola cuenta ,78,4.5,21,https://www.udemy.com/course/como-invertir-en-forex/,Finance,es
inteligencia emocional con tu dinero,un curso que te brinda optimas herramientas para transformar tu capacidad de ganar administrar y disfrutar tu dinero ,73,4.1,21,https://www.udemy.com/course/inteligencia-emocional-con-tu-dinero/,Finance,es
introduccion al ahorro y la inversion,lo que necesitas saber antes de ahorrar y a la hora de elegir una inversion,45,4.9,20,https://www.udemy.com/course/introduccion-al-ahorro-y-la-inversion/,Finance,es
forex trading desde cero aprende a invertir con metatrader,aprenda todos los secretos de la plataforma de operaciones meta trader ,71,4.3,19,https://www.udemy.com/course/aprende-forex-desde-cero/,Finance,es
stock trading la bolsa de valores,aprende a hacer trading e invertir en acciones en la bolsa de nueva york como lo hacen los profesionales ,50,4.1,18,https://www.udemy.com/course/el-trading-y-la-bolsa-de-valores/,Finance,es
estrategias de negociacion intradia para contratos de futuro,aprenda a negociar cualquier activo bursatil en cualquier tipo de mercado alcista bajista o lateral,47,4.4,18,https://www.udemy.com/course/daytradingstc/,Finance,es
sistema rentable automatico forex acciones eeuu,herramientas practicas para elegir los mejores trader que operen por nosotros en etoro ejemplos reales ,240,4.3,18,https://www.udemy.com/course/sistema-rentable-automatico-curso-trading-forex-acciones-eeuu/,Finance,es
guia para la libertad financiera,las estrategias herramientas y sistemas que debes adoptar,716,4.2,17,https://www.udemy.com/course/guia-para-la-libertad-financiera/,Finance,es
legalidad y fiscalidad de blockchain fintech criptomonedas, conoce los aspectos legales y fiscales de los bitcoins el crowfunding legaltech fintech regtech blockchain y mas ,66,4.0,15,https://www.udemy.com/course/legalidad-y-fiscalidad-de-blockchain-fintech-criptomonedas/,Finance,es
finanzas personales e inversiones para novatos jugando,aprende herramientas productivas para definir tu propio juego financiero en la vida real curso mejor valorado ,73,4.1,15,https://www.udemy.com/course/finanzas-personales-e-inversiones-para-novatos-jugando/,Finance,es
aprende a hacer paper trading simulacion con ninja trader,una herramienta valiosa para el entrenamiento de los nuevos traders antes de arriesgar su cuenta en el mercado real ,196,4.1,15,https://www.udemy.com/course/aprende-a-hacer-paper-trading-simulacion-con-ninja-trader/,Finance,es
estrategia segura simple y efectiva para ganar con bitcoin,invierte y gana de forma independiente y privada ahorre de la forma mas segura y crea tu fondo para tu jubilacion,249,4.2,15,https://www.udemy.com/course/inversion-directa-en-bitcoin-localbitcoinscom/,Finance,es
sistema para ganar dinero e incrementar tus ingresos,sigue este sistema para conseguir mas ingresos,318,4.0,14,https://www.udemy.com/course/sistema-para-ganar-dinero-e-incrementar-tus-ingresos/,Finance,es
trading criptomonedas bitcoin,aprende nuestra estrategia holding trading,50,4.4,14,https://www.udemy.com/course/tradingcriptomonedas/,Finance,es
bases solidas sobre cadenas de bloques y bitcoin,entendiendo el blockchain a fondo ,23,4.4,13,https://www.udemy.com/course/bases-solidas-sobre-cadenas-de-bloques-y-bitcoin/,Finance,es
requisitos para hacer deducibles tus gastos ante el sat,curso de impuestos y deducciones mexico,61,4.2,12,https://www.udemy.com/course/requisitos-para-hacer-deducibles-tus-gastos-ante-sat-curso-impuestos/,Finance,es
iniciacion a bitcoin y las criptomonedas,en este curso adquiriras todos los conocimientos que vas a necesitar para iniciarte en el mundo de bitcoin ,56,4.5,11,https://www.udemy.com/course/iniciacion-a-bitcoin/,Finance,es
aprende a invertir en la bolsa con bajo riesgo ,el unico curso de inversiones con enfoque hacia tu ser ,35,4.1,11,https://www.udemy.com/course/inversionesconbajoriesgo/,Finance,es
 documentos clave para administrar tu empresa con exito,aprende todo lo que necesitas saber para llevar una buena contabilidad para tu empresa ,63,4.1,11,https://www.udemy.com/course/3-documentos-clave-para-administrar-tu-empresa-con-exito/,Finance,es
guia practica del analisis financiero,como hacer analisis financiero paso a paso,32,4.4,10,https://www.udemy.com/course/guia-practica-del-analisis-financiero/,Finance,es
caza los enormes movimientos del mercado,este es un curso breve y sin palabreria que muestra como predecir y operar en los grandes movimientos de los mercados de,20,4.3,9,https://www.udemy.com/course/caza-los-enormes-movimientos-del-mercado/,Finance,es
entrena tu mente,conoce como tu mente te ayuda o te sabotea para conseguir tus resultados,18,4.0,8,https://www.udemy.com/course/mentalidad-para-tu-exito-financiero/,Finance,es
como invertir en criptomonedas y ser un trader profesional ,conoce los patrones mas poderosos del analisis tecnico y opera como los profesionales ,25,4.5,8,https://www.udemy.com/course/como-ser-un-trader-exitoso-lacriptopedia/,Finance,es
evaluacion financiera de proyectos de inversion,aprende a calcular van tir flujos de efectivo wacc capm costos del capital accionario y de la deuda de tu proyecto,29,4.2,8,https://www.udemy.com/course/evaluacion-financiera-de-proyectos-de-inversion/,Finance,es
bitmex para principiantes,lleva tu trading a otro nivel,21,4.6,7,https://www.udemy.com/course/bitmex-para-principiantes/,Finance,es
ea estrategia profesional de trading de retrocesos,estrategia de trading profesional para cualquier tipo de mercado utilizando la plataforma ,40,4.7,7,https://www.udemy.com/course/trading-retrocesos-123/,Finance,es
como hacer empresa en sesiones practicas,guia para conocer como funcionan las empresas como se crean aun si no tienes capital y como obtener ganancias,44,5.0,7,https://www.udemy.com/course/finanzas-para-principiantes/,Finance,es
el abc del trading,en este curso vas a aprender todos los aspectos necesarios que necesitas si o si antes de volverte un trader pro,13,4.7,6,https://www.udemy.com/course/abcdeltrading/,Finance,es
 como identificar dolares falsos ,conteo de billetes dolares falsos fajar billetes luz ultravioleta conteo cerrado limpiar billetes cajero,346,4.4,6,https://www.udemy.com/course/conteo-e-identificacion-de-dolares-falsos-americanos/,Finance,es
prepara tu mente para la abundancia,atrae la abundancia todo el año,65,4.6,6,https://www.udemy.com/course/prepara-tu-mente-para-la-abundancia/,Finance,es
prepara tu mente para la abundancia,atrae la abundancia todo el año,65,4.6,6,https://www.udemy.com/course/prepara-tu-mente-para-la-abundancia/,Finance,es
contabilidad de los gastos de personal,aprende a registrar todos los gastos de personal ,21,4.4,5,https://www.udemy.com/course/contabilidad-de-los-gastos-de-personal/,Finance,es
curso de finanzas personales ejercicios practicos,simple util aplicable eficaz como nunca te lo enseñaron las mejores tecnicas para manejar tu dinero ,22,4.5,5,https://www.udemy.com/course/curso-de-finanzas-personales-ejercicios-practicos/,Finance,es
valor en riesgo en inversiones en crystal ball,aprende como desarrollar tu propio modelo de valor en riesgo en crystal ball para tu portafolio de inversion,8,4.0,5,https://www.udemy.com/course/valor-en-riesgo-en-inversiones-en-crystal-ball/,Finance,es
curso avanzado de trading para intradia scalping order flow,todo lo que el trader debe saber para llegar a la rentabilidad y consistencia ,23,4.4,5,https://www.udemy.com/course/curso-avanzado-de-trading-para-intradia-scalping-order-flow/,Finance,es
curso de inversion en bolsa trading ,aprende a invertir por ti mismo con acceso a operativa en directo veras como operan los profesionales ,27,4.4,5,https://www.udemy.com/course/curso-de-inversion-en-bolsa-trading/,Finance,es
maneja tus finanzas personales mientras aprendes excel , dos cursos en uno aprende a manejar tu dinero de manera mas eficiente mientras aprendes a usar excel ,16,4.2,4,https://www.udemy.com/course/maneja-tus-finanzas-personales-mientras-aprendes-excel-2013/,Finance,es
libertad financiera has de una idea un millon,liberate de las deudas y empieza a ser exitoso en tus finanzas,12,4.3,4,https://www.udemy.com/course/libertad-financiera-has-de-una-idea-un-millon/,Finance,es
como seleccionar fondos de inversion,daras un salto hacia adelante en tus conocimientos financieros sobre fondos de inversion y tus ahorros lo notaran,26,4.7,4,https://www.udemy.com/course/seleccionar-fondos-inversion/,Finance,es
guia practica de finanzas personales,organiza y automatiza tus finanzas de forma sencilla,15,4.3,4,https://www.udemy.com/course/guia-practica-de-finanzas-personales/,Finance,es
invierte en la bolsa de ee uu trading on line con ninja t ,aprende trading desde cero a traves de graficas de transacciones en vez de velas japonesas,5,4.8,3,https://www.udemy.com/course/trading-on-line-mercado-de-futuros-sp-500/,Finance,es
libertad financiera en pasos estrategias de inversion,descubre los secretos que nunca te contaron para potenciar tus finanzas personales y tener seguridad economica,12,4.1,3,https://www.udemy.com/course/libertad-financiera-en-7-pasos-estrategias-de-inversion/,Finance,es
reforma tributaria de estados unidos,impacto en las empresas mexicanas,9,5.0,3,https://www.udemy.com/course/reforma-tributaria-estados-unidos/,Finance,es
logra tu libertad financiera,descubre que aun cuando vives al dia es posible aplicando estas simples tecnicas en el uso de tu dinero,142,4.2,3,https://www.udemy.com/course/libertad-financiera-por-donde-empiezo/,Finance,es
la independencia financiera saca provecho de tus recursos,mejora el rendimiento y reduce el riesgo de tu inversion alcanza la independencia financiera y se dueño de tu destino ,6,4.2,3,https://www.udemy.com/course/independencia-financiera/,Finance,es
forex trading opera como un verdadero profesional,enseñamos un sistema de trading desde lo mas basico a lo mas avanzado opera como un verdadero profesional,293,4.4,3,https://www.udemy.com/course/forex-trading-opera-como-un-verdadero-profesional/,Finance,es
diario de trading,aprender a desarrollar un diario de trading,12,4.5,3,https://www.udemy.com/course/diario-de-trading/,Finance,es
auxiliar contable,proceso contable pcge elaboracion y presentacion de estados financieros paso a paso de acuerdo a nics,14,4.4,2,https://www.udemy.com/course/contabilidad-basica/,Finance,es
auxiliar contable,proceso contable pcge elaboracion y presentacion de estados financieros paso a paso de acuerdo a nics,14,4.4,2,https://www.udemy.com/course/contabilidad-basica/,Finance,es
gestion eficiente de clinica hospital veterinario,aumentar nuestras ganancias siendo eficientes y sobre todo crecer dia a dia cuidando a nuestros pacientes,4,4.0,2,https://www.udemy.com/course/gestion-eficiente-de-clinicahospital-veterinario/,Finance,es
habilidades financieras claves de liderazgo ,habilidades y herramientas necesarias para mejorar nuestra libertad financiera ,12,4.3,2,https://www.udemy.com/course/hablemos-de-dinero/,Finance,es
economia principios de economia,fundamentos esenciales para comprender y analizar criticamente la economia dirigido a estudiantes y emprendedores ,11,5.0,2,https://www.udemy.com/course/economia-1-principios-de-economia/,Finance,es
contabilidad de propiedad planta y equipo bajo nic n,contabilizacion medicion y reconocimiento de propiedad planta y equipo,4,5.0,2,https://www.udemy.com/course/contabilidad-de-propiedad-planta-y-equipo-bajo-nic-n16/,Finance,es
economia financiera,curso destinado a todas las personas que quieran conocer los fundamentos basicos de las finanzas ,18,5.0,1,https://www.udemy.com/course/economiafinanciera/,Finance,es
finanzas personales e inversiones sin riesgo,aprende de dinero ahorros e inversion,4,4.0,1,https://www.udemy.com/course/finanzas-personales-e-inversiones-sin-riesgo/,Finance,es
finanzas personales y como empezar a invertir,el primer paso para tu libertad financiera,1,5.0,1,https://www.udemy.com/course/finanzas-personales-y-como-empezar-a-invertir/,Finance,es
inteligencia financiera para principiantes,conceptos basicos para controlar tu dinero,4,4.5,1,https://www.udemy.com/course/inteligenciafinancierafase1/,Finance,es
ahorra en tu factura energetica,ahorra energia mejorando el medioambiente y tu propio bolsillo ,9,5.0,1,https://www.udemy.com/course/ahorra-en-tu-factura-energetica/,Finance,es
forex masterclass de cero a avanzado ejemplos en vivo,en este masterclass hemos resumido la informacion mas exclusiva que te permitira conseguir resultados inmediatos ,0,5.0,1,https://www.udemy.com/course/forex-masterclass-de-cero-a-avanzado-ejemplos-en-vivo/,Finance,es
