Title,Summary,Enrollment,Stars,Rating,Link,Category,languages
aprende autocad para topografia y obras civiles ,aprende a crear diseños y obras lineales basicas con el software autocad aplicado a topografia y obras civiles,516,4.4,96,https://www.udemy.com/course/aprende-autocad-civil3d-para-topografia-y-obras-civiles-25/,Design,es
curso de chapa metalica en solidworks ,curso enfocado a la creacion de gabinetes y cajas electricas hechas con chapa metalica ,349,4.3,95,https://www.udemy.com/course/curso-de-chapa-metalica-solidworks-2016/,Design,es
impresion de a ,aprende todo sobre impresion y se un experto desde conceptos fundamentales hasta conceptos avanzados ,456,4.1,94,https://www.udemy.com/course/impresion-3d-de-0-a-100/,Design,es
crea una libreria de juegos con php mysql ajax y proyectos,crea sistemas con php mysql y ajax libreria carrito de compras y proceso de compra completo ,2039,4.7,93,https://www.udemy.com/course/aprende-ajax-php-y-mysql-con-3-proyectos-practicos-y-reales/,Design,es
creacion de personajes con zbrush gold pack vol y , cursos de la serie creacion de personajes con zbrush cuerpo cabeza manos y pies anatomicamente correctos,764,4.8,93,https://www.udemy.com/course/gold-pack-creacion-de-personajes-con-zbrush-vol-1-2-y-3/,Design,es
adobe illustrator cc curso completo desde cero,ya no tienes excusa puedes aprender illustrator sin tener conocimientos previos facil y rapido ,1058,4.2,90,https://www.udemy.com/course/curso-de-illustrator-cc/,Design,es
primeros pasos para aprender a tatuar,conviertete en aprendiz del tatuaje,207,4.6,89,https://www.udemy.com/course/primeros-pasos-para-aprender-a-tatuar/,Design,es
curso de photoshop cc para arquitectura ,aprende a manejar photoshop desde para usarlo en tus proyectos de arquitectura ,2466,4.4,89,https://www.udemy.com/course/curso-de-photoshop-cc-para-arquitectura/,Design,es
redes de tuberias con autocad civil ,aprende los detalles de la creacion de redes de tuberias con civil a traves de un dibujo real de alcantarillado,362,4.0,84,https://www.udemy.com/course/redes-de-tuberias-con-autocad-civil-3d/,Design,es
master crea a sylvanas vol cuerpo y cabeza,entiende las base de la anatomia humana para la creacion de personajes de alta calidad ,1634,4.9,84,https://www.udemy.com/course/sylvanas-vol1-cuerpo-cabeza/,Design,es
layout para sketchup diseño avanzado de presentaciones ,un programa sencillo y eficaz que convierte tus modelos de sketchup en diagramas dibujos documentos presentaciones,519,4.7,83,https://www.udemy.com/course/layout-sketchup/,Design,es
diseña imprimibles para fiestas tematicas con powerpoint,aprende a diseñar la papeleria para una fiesta tematica con powerpoint,175,4.8,82,https://www.udemy.com/course/disena-imprimibles-para-fiestas-tematicas-con-powerpoint/,Design,es
creacion de terrazas y vialidades con civil ,aprende a crear la topografia modificada utilizando las herramientas de civil ,300,4.4,79,https://www.udemy.com/course/creacion-de-terrazas-y-vialidades-con-civil-3d/,Design,es
bootstrap para zombies de novato a sensei ,dominar bootstrap nunca fue tan facil unete a nosotros mientras enseñamos un zombi a trabajar con bootstrap ,336,4.1,78,https://www.udemy.com/course/curso-bootstrap-4-para-zombies/,Design,es
illustrator cc curso de diseño e ilustracion de a ,dominalo desde cero para crear ilustraciones anuncios efectos de texto afiches papeleria empresarial iconos y mas,266,4.8,77,https://www.udemy.com/course/curso-versatil-de-illustrator-cc-de-cero-a-experto/,Design,es
canva curso completo de diseño grafico,diseño grafico para principiantes aprende a crear diseños increibles con canva,812,4.0,76,https://www.udemy.com/course/canva-curso-completo-de-diseno-grafico/,Design,es
crear un proyecto completo con sketchup en solo hora ,aprenderas el flujo de trabajo con sketchup para poder llevar a cabo un proyecto completo de interiorismo paso a paso ,1758,4.1,75,https://www.udemy.com/course/crear-un-proyecto-completo-con-sketchup-en-solo-1-hora/,Design,es
diseña imprimibles para fiestas tematicas con illustrator,aprende a crear y diseñar los elementos basicos para armar las decoraciones de una fiesta tematica con adobe illustrator,200,4.8,74,https://www.udemy.com/course/disena-imprimibles-para-fiestas-tematicas/,Design,es
programador web y responsive facil y practico ,aprende a diseñar paginas web profesionales y actuales desde cero de forma facil dinamica y muy practica ,209,4.2,74,https://www.udemy.com/course/programador-web-html5-y-css3-responsive-facil-y-practico/,Design,es
wordpress conviertete en un experto en pocas horas,curso completo de wordpress empieza a ganar dinero con horas de tu tiempo no requiere experiencia preguntanos ,230,4.3,73,https://www.udemy.com/course/curso-aprender-wordpress-completo/,Design,es
 y master fundamentos de diseño web profesional ,aprende los fundamentos profesionales del diseño web usando los lenguajes y ,287,4.5,73,https://www.udemy.com/course/html5-css3-master/,Design,es
curso basico de diseño de jardines,como diseñar un jardin de manera profesional paso a paso,239,4.0,73,https://www.udemy.com/course/curso-diseno-de-jardines/,Design,es
adobe photoshop los fundamentos,curso introductorio de adobe photoshop para usuarios con poca o ninguna experiencia en el programa ,2361,4.4,72,https://www.udemy.com/course/adobe-photoshop-cs6-fundamentos/,Design,es
administracion de hosting hostgator,paso a paso como administrar tu hostgator,378,4.6,3,https://www.udemy.com/course/hostgator/,Design,es
curso avancado de kdenlive,aprenda a usar o kdenlive de vez ,203,4.4,69,https://www.udemy.com/course/curso-avancado-de-kdenlive/,Design,es
fotomontaje avanzado para diseñadores y fotografos,mejora tus tecnicas de fotomanipulacion y edicion en photoshop,381,4.4,69,https://www.udemy.com/course/cursos-de-fotomontaje-para-disenadores-y-fotografos/,Design,es
fundamentos de la tipografia para un diseño eficaz,introduccion al uso efectivo de la tipografia como usarla correctamente y obtener resultados de calidad profesional,305,4.2,69,https://www.udemy.com/course/los-fundamentos-de-la-tipografia/,Design,es
climatizacion aire acondicionado y hvac,tecnologias de climatizacion calculo de cargas termicas y seleccion de sistemas de climatizacion de edificios ,218,4.4,69,https://www.udemy.com/course/climatizacion-aire-acondicionado-y-hvac/,Design,es
after effects cc todos los niveles,aprende tecnicas para trabajar de una forma eficiente y obtener buenos resultados en cada proyecto,279,4.6,65,https://www.udemy.com/course/adobe-after-effects-cc-2019-todos-los-niveles/,Design,es
coreldraw aprende con proyectos reales ,formacion integral sobre la maquetacion e ilustracion de proyectos de diseño con corel draw paso a paso de a experto,5781,4.3,64,https://www.udemy.com/course/coreldraw-graphics-suite/,Design,es
autocad desde cero,curso de autocad hecho paso por paso para quienes no tienen conocimiento alguno sobre autocad ,178,4.0,63,https://www.udemy.com/course/autocad-2018-2d-desde-cero/,Design,es
adobe illustrator paso a paso con logos profesionales,desde cero te enseñamos las tecnicas mas actuales para diseños wow y para que empiece su propio negocio ,287,4.9,62,https://www.udemy.com/course/adobe-illustrator-logos-profesionales/,Design,es
photoshop master i nivel cero a nivel profesional, no sabes como funciona photoshop y quieres aprender desde cero este curso es para ti ,227,4.5,62,https://www.udemy.com/course/photoshop-master-i-nivel-cero-a-nivel-profesional/,Design,es
 max arnold render,aprende las herramientas de modelado texturizado iluminacion con arnold render ,198,4.7,61,https://www.udemy.com/course/aprende-3ds-max-2019-arnold-render/,Design,es
escultura digital con blender ,aprende a crear tus personajes en ,140,4.9,61,https://www.udemy.com/course/escultura-digital-con-blender-29/,Design,es
zbrush basico vol creacion de una mascota cartoon en z,buscando un tutorial o curso de zbrush en español donde aprender a crear personajes esculpir personajes en zbrush,221,4.6,59,https://www.udemy.com/course/master-3d-de-cero-a-heroe-en-zbrush-vol2-mascota-cartoon/,Design,es
master de cero a heroe vol anatomia del cuerpo,entiende las base de la anatomia humana para la creacion de personajes de alta calidad ,395,4.3,59,https://www.udemy.com/course/creacion-de-personajes-3d-fundamentos-de-anatomia-humana-i/,Design,es
vectorworks para arquitectos nivel intermedio,lleva tu conocimiento de vectorworks al siguiente nivel con explicaciones y practicas mas detalladas ,112,4.3,59,https://www.udemy.com/course/vectorworks-para-arquitectos-nivel-intermedio/,Design,es
paisajes digitales y diseño de escenarios de fantasia,aprende a pintar paisajes y escenarios de fantasia para el mundo de la ilustracion digital y concept art ,242,4.4,59,https://www.udemy.com/course/paisajes-digitales-y-escenarios-de-fantasia/,Design,es
experto en autocad ,aprende autocad trabaja de manera inteligente y manejalo como todo un experto,236,4.6,59,https://www.udemy.com/course/experto-en-autocad-2020/,Design,es
escultura de miniaturas con blender ,aprende a crear un personaje para impresion desde cero en este curso de mas de horas ,301,4.6,58,https://www.udemy.com/course/escultura-de-miniaturas-con-blender/,Design,es
gamificacion como se hace paso a paso para que funcione,diseño de sistemas ludificados que mejoran el rendimiento de los usuarios ,257,4.0,58,https://www.udemy.com/course/gamificacion-que-es-y-como-hacerla/,Design,es
curso de archicad completo desde cero y paso a paso,curso de archicad para principiantes completo y paso a paso incluye los ejercicios ,298,4.0,58,https://www.udemy.com/course/curso-de-archicad-completo-desde-cero-y-paso-a-paso/,Design,es
tecnicas para la creacion de elementos para videojuegos,modelado lowpoly y texturizado compuesto para videojuegos y aplicaciones interactivas max pho unreal y marmoset ,6745,4.2,57,https://www.udemy.com/course/tecnicas-para-la-creacion-de-elementos-3d-para-videojuegos/,Design,es
tecnicas photoshop matte painting de dia a noche,conoce todos los detalles de la tecnica que emplean los grandes cineastas denominada matte painting en adobe photoshop,254,4.7,57,https://www.udemy.com/course/tecnicas-photoshop-matte-painting-de-dia-a-noche/,Design,es
lumion de a , aprende a manejar lumion para hacer renders y recorridos virtuales increibles ,205,4.1,57,https://www.udemy.com/course/curso-lumion/,Design,es
sistema diedrico de para un en dibujo tecnico,aprende de una vez y para siempre el sistema diedrico el sistema de representacion mas universal en dibujo tecnico,148,4.9,54,https://www.udemy.com/course/sistema-diedrico-1/,Design,es
impresion impresoras para comenzar y continuar,lo necesario para sumergirse en el mundo de la impresion ,587,4.0,54,https://www.udemy.com/course/impresion-3d-impresoras-3d-para-comenzar-y-continuar/,Design,es
aprende a crear presupuesto en excel desde revit,usa la hoja de excel que siempre has utilizado para tus presupuestos enlazada a datos de revit,224,4.2,53,https://www.udemy.com/course/aprende-a-crear-presupuesto-en-excel-desde-revit/,Design,es
diseño ux historia del arte,aprende como la historia del arte puede hacer mejor al diseño ux,610,4.2,53,https://www.udemy.com/course/diseno-ux-historia-del-arte/,Design,es
bim mediciones en bim desde archivos ifc,mediciones en bim en sencillos pasos obten las mediciones y presupuesto de tu proyecto desde uno o mas modelos ifc,300,4.5,53,https://www.udemy.com/course/bim-5d-mediciones-y-presupuestos-en-bim-desde-archivos-ifc/,Design,es
photoshop organizacion de eventos y decoracion de fiestas,aprende a diseñar todas las graficas de una fiesta o evento tematico diseñando tu mismo el cotillon para un cumpleaños ,340,4.7,51,https://www.udemy.com/course/curso-de-photoshop-como-hacer-todo-para-tu-fiesta-tematica/,Design,es
aprende autocad para topografia y obras civiles ,aprende a crear diseños y obras lineales basicas con el software autocad aplicado a topografia y obras civiles,401,4.1,50,https://www.udemy.com/course/aprende-autocad-civil3d-para-topografia-y-obras-civiles-35/,Design,es
html y css para novatos un curso completo y practico,el curso donde aprenderas a dar tus primeros pasos en el mundo del diseño web,952,4.8,49,https://www.udemy.com/course/html-el-curso-completo-practico-y-desde-0-en-espanol/,Design,es
curso de revit desde cero paso a paso y con ejercicios,curso paso a paso creacion de un proyecto completo de construccion ,288,4.3,49,https://www.udemy.com/course/curso-de-revit-2017/,Design,es
adobe xd ux ui fundamentos de la experiencia de usuario,aprende adobe xd para obtener un trabajo de diseñador de interfaz de usuario y de experiencia de usuario ,463,4.2,48,https://www.udemy.com/course/adobexd-ux-ui-fundamentos-de-la-experiencia-de-usuario/,Design,es
archicad con enfoque bim,aprende a modelar y documentar un proyecto arquitectonico de una casa de un piso utilizando las herramientas de archicad,90,4.5,48,https://www.udemy.com/course/curso-online-de-archicad-21-con-enfoque-bim/,Design,es
cast wysiwyg curso de diseño en de iluminacion,diseño y presentacion en para tecnicos de iluminacion de espectaculos y diseñadores del medio audiovisual,74,4.9,46,https://www.udemy.com/course/cast-wysiwyg-r36/,Design,es
edita y crea audios profesionales con adobe audition ,edita y crea audios como los verdaderos expertos y profesionales ,197,4.2,45,https://www.udemy.com/course/edita-y-crea-audios-profesionales-con-adobe-audition-cs6/,Design,es
rigging personajes en maya ,rig corporal con calidad comercial,278,4.3,45,https://www.udemy.com/course/rigging-personajes-3d-en-maya/,Design,es
curso de canva desde cero hasta experto ,aprende como crear diseños profesionales desde cero con canva sin saber de diseño grafico de forma rapida y sencilla ,3879,4.7,46,https://www.udemy.com/course/curso-de-canva-desde-cero-hasta-experto/,Design,es
curso de autocad desde cero a avanzado y horas,incluye niveles basico intermedio avanzado y video tutoriales paso a paso en formal secuencial con ejercicios ,259,4.4,44,https://www.udemy.com/course/autocad-2015-basico-avanzado-y-3d/,Design,es
creando un robot en autodesk maya y zbrush,aprender a crear asombrosos personajes con maya y zbrush,285,4.3,44,https://www.udemy.com/course/creando-un-robot-en-maya-y-zbrush/,Design,es
canva diseño grafico facil y rapido para no diseñadores,proyectos reales paso a paso usando canva gratuita con diseños profesionales no requieres experiencia ,114,4.4,43,https://www.udemy.com/course/canva-para-negocios-disena-facil-con-proyectos-reales/,Design,es
seguridad maxima para joomla protege tu cms favorito,en este curso cubriremos las mejores practicas para reducir al minimo el riesgo de seguridad de un sitio joomla ,398,4.5,42,https://www.udemy.com/course/curso-de-seguridad-para-joomla/,Design,es
 le temes a autocad aprende su version desde cero,aumenta tus conocimientos y diferenciate de los demas aprendiendo a usar autocad ,113,4.5,42,https://www.udemy.com/course/aprende-autocad-2017-2d-desde-cero/,Design,es
render con v ray max español ,aprendiendo los parametros escenciales de renderizado con v ray,172,4.3,42,https://www.udemy.com/course/render-con-v-ray-35-3ds-max-2017-espanol/,Design,es
sketchup para arquitectos o estudiantes de arquitectura,crea maquetas virtuales y recorridos de tus proyectos arquitectonicos ,239,4.1,42,https://www.udemy.com/course/sketchup-para-arquitectos-o-estudiantes-de-arquitectura/,Design,es
mega pack en animacion de personajes de cero a pro,aprende animar personajes desde cero a nivel avanzado utilizando autodesk maya,308,4.2,41,https://www.udemy.com/course/mega-pack-5-en-1-animacion-de-personajes-3d-de-cero-a-pro/,Design,es
iluminacion natural en edificios con revit insight,analiza y mejora el comportamiento de tu edificio respecto la iluminacion natural con revit insight,451,4.4,41,https://www.udemy.com/course/plugin-revit-insight-iluminacion-natural-en-edificios/,Design,es
curso de autocad civil basico e intermedio,el usuario quedara en capacidad de elaborar y modificar planos topograficos y de obras civiles de manera profesional ,275,4.1,41,https://www.udemy.com/course/curso-de-autocad-civil-3d-2014-basico-e-intermedio/,Design,es
master en arquitectura ecologica sostenible y bioclimatica ,convierte en profesional del diseño gestion y planificacion sostenible y medio ambientalmente eficiente ,2713,4.3,41,https://www.udemy.com/course/arquitectura-sostenible/,Design,es
curso en design thinking como crear productos y servicios,aprende que es design thinking y como aplicarlo en la creacion de productos y servicios exitosos somos los numero ,123,4.2,40,https://www.udemy.com/course/como-crear-productos-y-servicios-con-design-thinking/,Design,es
imagenes fotorrealistas con vray interioristas decoradores,consigue imagenes realistas de tus diseños curso de renderizado con v ray para diseñadores de interiores decoradores,3650,4.6,40,https://www.udemy.com/course/imagenes-fotorrealistas-con-vray-interioristas-decoradores/,Design,es
maquetacion web profesional con wordpress elementor free,sacale todo el partido a elementor con consejos y trucos que no estan disponibles en la version free ,436,4.5,40,https://www.udemy.com/course/maquetacion-web-profesional-con-wordpress-elementor-free/,Design,es
adobe illustrator cc desde cero hasta nivel avanzado ,curso completo de adobe illustrator aprende a diseñar como los mejores animate y comienza a vectorizar ,4047,4.8,40,https://www.udemy.com/course/illustrator-curso/,Design,es
creacion y modelado de vestuario con marvelous designer,aprende a crear prendas y vestuario realista para tus modelos ,158,4.3,39,https://www.udemy.com/course/marvelous-designer/,Design,es
experto en diseño urbano planificacion y paisaje ,convierte en un especialista en el diseño y proyeccion de elementos urbanos y paisajisticos de la mano de arquitectos ,2437,4.3,39,https://www.udemy.com/course/master-urbanismo-en-diseno-urbano-planificacion-y-paisaje/,Design,es
master de cero a heroe vol anatomia de la cabeza,entendiendo las conceptos de la anatomia para la creacion de la cabeza de un personaje realista con zbrush ,203,4.5,38,https://www.udemy.com/course/creacion-de-personajes-3d-con-zbrush-pt-2-la-cabeza/,Design,es
fundamentos de composicion,aprende los principios de la composicion para mejorar tus ilustraciones fotografias piezas de diseño grafico o arte ,648,4.4,38,https://www.udemy.com/course/fundamentos-de-composicion-para-ilustracion-y-concept-art/,Design,es
pack en creacion cabello y rigging de un personaje,aprende todo el proceso de un personaje cubriendo modelado esculpido texturizado cabello y rigging en maya y zbrush,186,4.5,36,https://www.udemy.com/course/pack-3-en-1-creacion-cabello-y-rigging-de-un-personaje/,Design,es
inkscape facil edicion de graficos vectoriales,aprende a crear y editar graficos vectoriales con inkscape una herramienta gratuita profesional y en codigo abierto ,135,4.6,36,https://www.udemy.com/course/curso-de-inkscape/,Design,es
 videotutoriales de photoshop cc aprende paso a paso,aprende photoshop cc desde el principio curso de edicion de imagenes para principiantes ejemplos practicos y efectivos,241,4.3,36,https://www.udemy.com/course/60-videotutoriales-de-photoshop-cc-aprende-paso-a-paso/,Design,es
inkscape facil edicion de graficos vectoriales,aprende a crear y editar graficos vectoriales con inkscape una herramienta gratuita profesional y en codigo abierto ,135,4.6,36,https://www.udemy.com/course/curso-de-inkscape/,Design,es
arcgis tutorial paso a paso,aprende arcgis paso a paso de cero a avanzado y conviertete en un experto manejando este software ,2019,4.5,35,https://www.udemy.com/course/arcgis-online-arc-gis-tutorial-paso-a-paso-de-ceroavanzado/,Design,es
illustrator desde cero a experto,crea bonitas ilustraciones vectoriales con el programa de diseño n º ,809,4.1,35,https://www.udemy.com/course/illustrator-desde-cero-a-experto-netcurso/,Design,es
construye paginas web modernas y profesionales con elementor,el curso definitivo para aprender a utilizar elementor gratuito y pro de principio a fin haz paginas mucho mas modernas,116,4.3,34,https://www.udemy.com/course/construye-paginas-web-modernas-y-profesionales-con-elementor/,Design,es
curso de wordpress intermedio,herramientas y consejos para desarrollar un sitio web profesional con wordpress,881,4.4,34,https://www.udemy.com/course/curso-de-wordpress-intermedio-para-novatos/,Design,es
modelado texturizado y rigging de un personaje en maya ,aprende todo el proceso en la creacion de un personaje modelado texturizado y rigging ,137,4.4,34,https://www.udemy.com/course/modelado-texturizado-y-rigging-de-un-personaje-en-maya-2018/,Design,es
aprende a colocar porcelanato liquido,no te pierdas esta posibilidad de capacitarte de manera online quedateencasa,103,4.2,35,https://www.udemy.com/course/aprende-a-colocar-porcelanato-liquido-curso-online/,Design,es
curso de diseño e ilustracion de armas para videojuegos,aprende a diseñar y conceptualizar eficazmente armas y objetos para videojuegos de fantasia medieval y futuristas ,255,4.1,34,https://www.udemy.com/course/curso-de-diseno-e-ilustracion-de-armas-para-videojuegos/,Design,es
aprende la concepcion y el diseño de infografias,diseña infografias profesionales para transmitir tu mensaje de manera sencilla a tus usuarios,141,4.1,34,https://www.udemy.com/course/aprende-la-concepcion-y-el-diseno-de-infografias/,Design,es
autocad esencial profesional,adaptado para certificarse por autodesk se enseña desde cero ,295,4.5,33,https://www.udemy.com/course/autocad-esencial-2d-netcurso/,Design,es
adobe animate cc de cero a profesional ,aprende a animar desde el dia con ejercicios tips y ejemplos ,106,4.7,32,https://www.udemy.com/course/adobe-animate-cc-2018-maraares/,Design,es
elementos de maquinas con solidworks engranajes,curso practico de cero a experto,2213,4.7,33,https://www.udemy.com/course/elementos-de-maquinas-con-solidworks-engranajes/,Design,es
introduccion al diseño mecanico gratuito con freecad,accede al universo del diseño gratuito con freecad conoceras todas las posibilidades de este software de diseño ,96,4.4,31,https://www.udemy.com/course/introduccion-al-diseno-mecanico-3d-gratuito-con-freecad/,Design,es
diseño de logo con reticulas desde cero,diseña tu identidad visual con reticulas,79,4.5,31,https://www.udemy.com/course/diseno-de-logo/,Design,es
creacion de modelos pintados a mano para videojuegos,aprende la tecnica pintado a mano de los profesionales en la industria de los video juegos para crear contenido ,127,4.5,31,https://www.udemy.com/course/creacion-de-modelos-3d-pintados-a-mano-para-videojuegos/,Design,es
aprende a crear animaciones svg con iconos ,crea increibles animaciones para web botones iconos graficos empleando el formato svg en tus proyectos ,154,4.5,31,https://www.udemy.com/course/aprende-a-crear-animaciones-svg-con-iconos/,Design,es
curso iclone , que puede hacer iclone por ti ,110,4.3,29,https://www.udemy.com/course/curso-iclone-7/,Design,es
presentacion con iconos animados en after effects,aprende a combinar herramientas de after effects para diseñar una presentacion animando texto iconos y capas de formas,98,4.2,29,https://www.udemy.com/course/presentacion-con-iconos-animados-en-after-effects/,Design,es
aprende photoshop en dias,aprende todas las herramientas de photoshop con ejercicios practicos en solo dias,129,4.6,29,https://www.udemy.com/course/photoshop-en-18-dias/,Design,es
como crear una tienda online gratis paso a paso ,aprende como crear una tienda online gratis paso a paso sin saber de programacion de forma rapida y sencilla ,1638,4.0,29,https://www.udemy.com/course/como-crear-una-tienda-online-gratis-paso-a-paso-desde-cero/,Design,es
unity modelado para videojuegos con probuilder ,aprender desde cero modelado de assets para videojuegos uv mapping con unity probuilder y progrids ,263,4.8,29,https://www.udemy.com/course/probuilder-disena-assets-3d-para-videojuegos-con-unity-3d/,Design,es
unity modelado para videojuegos con probuilder ,aprender desde cero modelado de assets para videojuegos uv mapping con unity probuilder y progrids ,263,4.8,29,https://www.udemy.com/course/probuilder-disena-assets-3d-para-videojuegos-con-unity-3d/,Design,es
sketchup pro de a simples pasos para ser un experto , pasos para aprender mejorar y potenciar tu rendimiento en el modelado con sketchup pro ,197,4.6,29,https://www.udemy.com/course/sketchup-pro-de-0-a-100-simples-pasos-para-ser-un-experto/,Design,es
universidad bootstrap crea un sitio web real techsmith,aprende bootstrap construyendo el diseño de un sitio web real paso a paso un curso de bootstrap para la vida real ,218,4.9,29,https://www.udemy.com/course/universidad-bootstrap-disena-un-sitio-web-real-beginner/,Design,es
master en autocad aprende paso a paso y desde cero ,el mejor curso para aprender a dibujar con autocad y dominar diseño de planos profesionales desde cero y paso a paso,130,4.0,29,https://www.udemy.com/course/master-en-autocad-2018-aprende-paso-a-paso-y-desde-cero-2d/,Design,es
diseño de personajes para animacion,aprende diseño de personajes en el estilo de dibujos animados modernos desde cero ,190,4.6,29,https://www.udemy.com/course/diseno-de-personajes-para-animacion-con-inkscape/,Design,es
leed green associate preparacion para examen en español,aplica tus conocimientos leed en la practica,73,4.3,28,https://www.udemy.com/course/leed-green-associate-v4-preparacion-examen-espanol/,Design,es
render con v ray max photoshop exteriores ,taller renderizado en max v ray y photoshop basado en un proyecto exterior dia noche,136,4.3,28,https://www.udemy.com/course/taller-de-visualizacion-arquitectonica-3ds-max-vray-phot/,Design,es
curso de basico de introduccion,curso de basico y de introduccion desde cero ,200,4.3,29,https://www.udemy.com/course/sap2000-curso-basico-de-introduccion/,Design,es
